{
  "$schema": "https://json-schema.org/draft/2020-12/schema",
  "$id": "https://schemas.testbraid.invalid/v1/media.schema.json",
  "type": "object",
  "required": [
    "schemaVersion",
    "id",
    "kind",
    "mimeType",
    "extension",
    "sizeBytes",
    "originalName",
    "createdAt"
  ],
  "properties": {
    "schemaVersion": {
      "const": 1
    },
    "id": {
      "type": "string",
      "minLength": 1,
      "maxLength": 128,
      "pattern": "^[A-Za-z0-9][A-Za-z0-9._-]*$"
    },
    "kind": {
      "enum": [
        "image",
        "video"
      ]
    },
    "mimeType": {
      "type": "string",
      "minLength": 1,
      "maxLength": 200
    },
    "extension": {
      "type": "string",
      "pattern": "^[a-z0-9]{1,16}$"
    },
    "sizeBytes": {
      "type": "integer",
      "minimum": 0
    },
    "originalName": {
      "type": "string",
      "minLength": 1,
      "maxLength": 1024
    },
    "createdAt": {
      "type": "string",
      "pattern": "^\\d{4}-\\d{2}-\\d{2}T\\d{2}:\\d{2}:\\d{2}(?:\\.\\d+)?Z$"
    },
    "groupId": {
      "type": [
        "string",
        "null"
      ],
      "pattern": "^[0-9a-f]{8}-[0-9a-f]{4}-4[0-9a-f]{3}-[89ab][0-9a-f]{3}-[0-9a-f]{12}$"
    }
  },
  "additionalProperties": false
}
