{
    "schemaVersion": 1,
    "id": "7775be41-c799-473b-a4ae-f38fdb7120e1",
    "kind": "image",
    "mimeType": "image/png",
    "extension": "png",
    "sizeBytes": 1988,
    "originalName": "blue-circle.png",
    "createdAt": "2026-10-29T12:00:00Z",
    "groupId": "e7472376-d56a-4384-ad1c-a1606dabddb7"
}
