{
    "schemaVersion": 1,
    "id": "07a23619-a0d3-4d4d-964e-0d571b79f577",
    "kind": "image",
    "mimeType": "image/png",
    "extension": "png",
    "sizeBytes": 1876,
    "originalName": "green-triangle.png",
    "createdAt": "2026-10-29T12:00:00Z",
    "groupId": "e7472376-d56a-4384-ad1c-a1606dabddb7"
}
