{
    "schemaVersion": 1,
    "id": "f8dae869-472e-4880-bc0d-dd088106fc24",
    "kind": "image",
    "mimeType": "image/png",
    "extension": "png",
    "sizeBytes": 1376,
    "originalName": "blue-square.png",
    "createdAt": "2026-10-29T12:00:00Z",
    "groupId": "e7472376-d56a-4384-ad1c-a1606dabddb7"
}
