{
    "schemaVersion": 1,
    "id": "0c0b43d6-8550-4e43-8b67-39f62060b93a",
    "kind": "video",
    "mimeType": "video/mp4",
    "extension": "mp4",
    "sizeBytes": 8949,
    "originalName": "ball-bouncing.mp4",
    "createdAt": "2026-10-29T12:00:00Z",
    "groupId": "e7472376-d56a-4384-ad1c-a1606dabddb7"
}
