{
    "schemaVersion": 1,
    "id": "89dc324e-2d9d-4627-8807-2d72d4682c0c",
    "kind": "video",
    "mimeType": "video/mp4",
    "extension": "mp4",
    "sizeBytes": 7468,
    "originalName": "ball-left-to-right.mp4",
    "createdAt": "2026-10-29T12:00:00Z",
    "groupId": "e7472376-d56a-4384-ad1c-a1606dabddb7"
}
