{
    "schemaVersion": 1,
    "id": "0821a7ae-ef1a-4c6d-8618-13d729a27d37",
    "kind": "image",
    "mimeType": "image/png",
    "extension": "png",
    "sizeBytes": 1985,
    "originalName": "red-circle.png",
    "createdAt": "2026-10-29T12:00:00Z",
    "groupId": "e7472376-d56a-4384-ad1c-a1606dabddb7"
}
